{
  "schemaVersion": "artifacts.fkr.dev/v1",
  "id": "ethic-brawl",
  "title": "Ethic Brawl",
  "description": "Published independent submodule pinned to the parent-owned reachable revision; mixed 1.7 rescue work remains local until browser and release reconciliation is complete.",
  "kind": "application",
  "status": "provisional",
  "required": true,
  "tags": ["game", "project", "submodule"],
  "source": {
    "kind": "project",
    "path": "ethic-brawl",
    "git": {
      "mode": "submodule",
      "repository": "https://github.com/fkr-0/ethic-brawl.git",
      "revision": "2754b6e9d12216613b615300cc9179687fda4e19"
    }
  },
  "build": {
    "mode": "compile",
    "cwd": "ethic-brawl",
    "command": ["pnpm", "run", "build"],
    "output": "dist"
  },
  "release": {
    "kind": "directory",
    "entrypoint": "index.html",
    "path": "dist",
    "offline": true
  },
  "launch": {
    "default": "inline",
    "modes": ["inline", "fullscreen", "newWindow"],
    "sandbox": "trusted"
  }
}
